{
    "schemaVersion": "1.0.0",
    "trace_id": "550e8400-e29b-41d4-a716-446655440000",
    "timestamp": "2025-12-16T12:00:00Z",
    "sourceAgent": "vector-dynamics-agent",
    "targetAgent": "analyst-agent",
    "payload": {
        "vectors": [
            {
                "id": "node-1",
                "role": "Self",
                "position": {
                    "x": 0.1,
                    "y": 0.2,
                    "z": -0.5
                },
                "velocity": {
                    "x": 0.01,
                    "y": 0.0,
                    "z": 0.0
                },
                "tension": 0.4
            }
        ],
        "globalEntropy": 0.35,
        "stabilityScore": 0.85,
        "timestamp": "2025-12-16T12:00:00Z"
    }
}