{
    "schemaVersion": "1.0.0",
    "trace_id": "550e8400-e29b-41d4-a716-446655440001",
    "timestamp": "2025-12-16T12:05:00Z",
    "sourceAgent": "analyst-agent",
    "targetAgent": "frontend",
    "payload": {
        "insights": [
            "High tension detected between Self and Paternal Lineage.",
            "Entropy indicates a stabilizing trend after recent mutations."
        ],
        "proposedActions": [
            {
                "actionId": "act-1",
                "label": "Shift Vector X Positive",
                "type": "MUTATE_VECTOR",
                "payload": {
                    "targetId": "node-1",
                    "delta": {
                        "x": 0.1
                    }
                }
            }
        ],
        "regimeContext": "COHERENT_THROUGHPUT"
    }
}