{
    "schemaVersion": "1.0.0",
    "trace_id": "550e8400-e29b-41d4-a716-446655440002",
    "timestamp": "2025-12-16T12:00:00Z",
    "sourceAgent": "analyst-agent",
    "targetAgent": "frontend",
    "payload": {
        "status": "HOLD",
        "reason": "System Entropy too high for narrative generation.",
        "retryAfterMs": 5000,
        "uiMode": "STABILIZE"
    }
}